21,Drs. ABDUL HALIM
22,ABDUL MUTALIB, S.Ag., M.Pd.I
23,H. ABU BAKAR JAMALIA
24,AL MUSYAIYAT
25,H. AZHAR MULIA, S.E
26,AZIM ANTONI NOREGA JAIS
27,Hj. DARYATI UTENG, S.E., M.M
28,Dra., Hj. ELVIANA, M.Si
29,H. ERIC HASMA, S.E., M.M
30,IBNU KHOLDUN. S.H., M.H
32,KHAIRUN A. RONI, S.E., M.M
33,M. HENDRI M. NUR, S.H
34,M. SUM INDRA, S.E., M.MSi
35,H. M. SYUKUR, S.H., M.H
36,MUSTHAFA LUTHFI, S.Ag., M.M
37,RIA MAYANG SARI, S.H., M.H
38,H. SAIPUL AZWAR, S.Pt
39,SALMAH MAHIR ISHAK, S.E
40,YASIR, S.E., M.E
41,YUAN FANESYAH, S.T
